cardId,setSeries,idInSetSeries,icon,backIcon,name,versionName,color,cost,cardType,classification,willpower,strength,loreValue,rarity,inkwellFlag,vanillaFlag,bodyguardFlag,challengerFlag,evasiveFlag,recklessFlag,resistFlag,rushFlag,shiftFlag,singerFlag,singTogetherFlag,supportFlag,wardFlag,effectText,flavorText
3104,03_ＩＮＴＯ ＴＨＥ ＩＮＫＬＡＮＤＳ　インクランド探訪,104,,,ビリー・ボーンズ,地図の所持者,4_ruby,5,1_character,ストーリーボーン・エイリアン・海賊,5,6,1,1_common,1,1,0,0,0,0,0,0,0,0,0,0,0,-,「俺の宝箱を狙ってる、悪魔みたいなサイボーグと血なまぐさい手下たち…」
3105,03_ＩＮＴＯ ＴＨＥ ＩＮＫＬＡＮＤＳ　インクランド探訪,105,,,フック船長,剣の達人,4_ruby,5,1_character,ドリームボーン・ヴィランズ・海賊・キャプテン,4,5,1,3_rare,1,0,0,0,2,0,0,0,0,0,0,0,0,仇敵 あなたのターンの間、このキャラクターがチャレンジ中に他のキャラクター１体を退場させるたび、これをレディする。これはこのターン、クエストできない。臆病スズメめ！ 《ピーター・パン》という名前のキャラクターは回避を失い、回避を得られない。,-
3106,03_ＩＮＴＯ ＴＨＥ ＩＮＫＬＡＮＤＳ　インクランド探訪,106,,,デラ・ダック,無敵のママ,4_ruby,2,1_character,ストーリーボーン・仲間,3,3,0,1_common,1,0,0,0,0,2,0,0,0,0,0,0,0,暴勇（このキャラクターはクエストできず、可能ならチャレンジする。）,「私は月で10年ひっどい味のガム嚙んでたのよ。フラッドまみれがなんだってのよ？」
3107,03_ＩＮＴＯ ＴＨＥ ＩＮＫＬＡＮＤＳ　インクランド探訪,107,,,ヘイヘイ,いつのまにか探検家,4_ruby,2,1_character,ストーリーボーン・仲間,2,3,1,2_uncommon,1,0,0,0,0,0,0,0,0,0,0,0,0,考えなしにうろうろ 各ターンに一度、このキャラクターがロケーションに移動したとき、各対戦相手はロアを１つ失う。,ここにニワトリ、コケナッツ。
3108,03_ＩＮＴＯ ＴＨＥ ＩＮＫＬＡＮＤＳ　インクランド探訪,108,,,ヒュドラ,大蛇の怪物,4_ruby,6,1_character,ストーリーボーン,5,6,2,5_legendary,1,0,0,0,0,0,0,0,0,0,0,0,0,牙だ、牙に気をつけろ このキャラクターがダメージを受けるたび、対戦相手のキャラクター１体を選び、同じ数のダメージを与える。,頭数は多ければ多いほどいい。
3109,03_ＩＮＴＯ ＴＨＥ ＩＮＫＬＡＮＤＳ　インクランド探訪,109,,,ジム・ホーキンス,宇宙の旅人,4_ruby,5,1_character,ストーリーボーン・ヒーロー,4,4,2,5_legendary,1,0,0,0,0,0,0,0,0,0,0,0,0,この地図が導いてくれる！ このキャラクターをプレイしたとき、コスト４以下のロケーション１枚をコストを支払わずにプレイしてもよい。僕が舵を握る あなたがロケーションをプレイするたび、このキャラクターをコストを支払わずにそのロケーションに移動してもよい。,「おめえは全宇宙の星を揺り動かすぞ」― ジョン・シルバー
3110,03_ＩＮＴＯ ＴＨＥ ＩＮＫＬＡＮＤＳ　インクランド探訪,110,,,ジム・ホーキンス,スリルの追求者,4_ruby,2,1_character,ドリームボーン・ヒーロー,2,3,1,1_common,1,1,0,0,0,0,0,0,0,0,0,0,0,-,ビッグな報酬が欲しいなら、ビッグなことにチャレンジしなきゃ。
3111,03_ＩＮＴＯ ＴＨＥ ＩＮＫＬＡＮＤＳ　インクランド探訪,111,,,カカモラ,脅威の船員,4_ruby,3,1_character,ストーリーボーン・海賊,2,3,1,1_common,1,0,0,0,0,0,0,0,0,0,0,0,0,略奪 このキャラクターをプレイしたとき、各対戦相手はロアを１つ失う。,コイツが来たところにはもっとウジャウジャいる。
3112,03_ＩＮＴＯ ＴＨＥ ＩＮＫＬＡＮＤＳ　インクランド探訪,112,,,マダム・メデューサ,ザ・ボス,4_ruby,6,1_character,ストーリーボーン・ヴィランズ,4,4,1,4_superrare,1,0,0,0,0,0,0,0,0,0,0,0,0,どうかしてる女 このキャラクターをプレイしたとき、対戦相手の３以下のキャラクター１体を選び、退場させる。,「ロアを見つけるくらい、子供からお菓子を取り上げるくらい簡単だろうさ」
3113,03_ＩＮＴＯ ＴＨＥ ＩＮＫＬＡＮＤＳ　インクランド探訪,113,,,マウイ,空翔ける半神,4_ruby,3,1_character,ストーリーボーン・ヒーロー・神格,2,5,0,2_uncommon,1,0,0,0,0,2,0,0,0,0,0,0,0,暴勇（このキャラクターはクエストできず、可能ならチャレンジする。）腹に入れてやる あなたの《ヘイヘイ》という名前のキャラクター１体がクエストするたび、このキャラクターはこのターン、+１され、暴勇を失う。,「ニワトリもっとその辺うろうろしてない？」
3114,03_ＩＮＴＯ ＴＨＥ ＩＮＫＬＡＮＤＳ　インクランド探訪,114,,,マウイ,クジラ,4_ruby,7,1_character,ストーリーボーン・ヒーロー・神格,8,8,1,3_rare,1,0,0,0,0,0,0,0,0,0,0,0,0,やっぱり呪われてる このキャラクターはあなたのターンの始めにレディしない。俺がついてるからな ２ ： このキャラクターをレディする。これはこのターン、クエストできない。,ドッバァーン！と登場準備ヨシ。
3115,03_ＩＮＴＯ ＴＨＥ ＩＮＫＬＡＮＤＳ　インクランド探訪,115,,,マイロ・サッチ,気鋭の学者,4_ruby,2,1_character,ストーリーボーン・ヒーロー,2,2,1,1_common,1,0,0,0,0,0,0,0,0,0,0,0,0,もちろん行きます！ このキャラクターはロケーションにいる間、+２される。,「おじいちゃんからはこんな場所のことは聞いてなかったよ！」
3116,03_ＩＮＴＯ ＴＨＥ ＩＮＫＬＡＮＤＳ　インクランド探訪,116,,,モアナ,生まれついてのリーダー,4_ruby,5,1_character,フラッドボーン・ヒーロー・プリンセス・キャプテン,4,4,2,3_rare,1,0,0,0,0,0,0,0,2,0,0,0,0,変身３（３を支払うことであなたの《モアナ》の上にこのカードをプレイしてもよい。）私の船へようこそ このキャラクターがロケーションにいる間、これがクエストするたび、そのロケーションにいる他のキャラクター全員をレディする。それらのキャラクターはこのターン、クエストできない。,-
3117,03_ＩＮＴＯ ＴＨＥ ＩＮＫＬＡＮＤＳ　インクランド探訪,117,,,モアナ,くじけない旅人,4_ruby,4,1_character,ストーリーボーン・ヒーロー・プリンセス,4,3,1,1_common,1,0,0,0,2,0,0,0,0,0,0,0,0,回避（このキャラクターには回避を持つキャラクターだけがチャレンジできる。）,火が降ろうと嵐が襲おうと、彼女は一心に目的地を目指す。
3118,03_ＩＮＴＯ ＴＨＥ ＩＮＫＬＡＮＤＳ　インクランド探訪,118,,,とんま,手下のハゲタカ,4_ruby,2,1_character,ストーリーボーン・仲間,3,2,1,1_common,1,1,0,0,0,0,0,0,0,0,0,0,0,-,「とんま、しゃべるでねえったら」― 早撃ち
3119,03_ＩＮＴＯ ＴＨＥ ＩＮＫＬＡＮＤＳ　インクランド探訪,119,,,ピーター・パン,ネバーランドのヒーロー,4_ruby,3,1_character,ストーリーボーン・ヒーロー,3,1,2,1_common,1,0,0,0,0,0,0,2,0,0,0,0,0,突進（このキャラクターはプレイされたターンにチャレンジできる。）ティンクこっちだ！ あなたの場に《ティンカー・ベル》という名前のキャラクターがいる間、このキャラクターは+２される。,ピーターと一緒の時は、「計画」は「危険に飛び込む」という意味になりがちだ。
3120,03_ＩＮＴＯ ＴＨＥ ＩＮＫＬＡＮＤＳ　インクランド探訪,120,,,ピーター・パン,海賊たちの天敵,4_ruby,6,1_character,フラッドボーン・ヒーロー,5,4,2,3_rare,1,0,0,0,2,0,0,0,2,0,0,0,0,変身４（４を支払うことであなたの《ピーター・パン》の上にこのカードをプレイしてもよい。）回避（このキャラクターには回避を持つキャラクターだけがチャレンジできる。）次はお前だ！ このキャラクターが海賊・キャラクター１体にチャレンジするたび、これはそのチャレンジによってダメージを受けない。,-
3121,03_ＩＮＴＯ ＴＨＥ ＩＮＫＬＡＮＤＳ　インクランド探訪,121,,,エリック王子,腕利きの舵取り,4_ruby,4,1_character,ドリームボーン・ヒーロー・プリンス,2,2,2,4_superrare,1,0,0,0,0,0,0,0,0,0,0,0,0,驚きの操船術 このキャラクターが退場したとき、キャラクター１体を選び、退場させてもよい。,どこからともなく嵐が巻き起こり、エリックはロルカナの果てにある謎めいた建造物にたどり着く前に引き返さざるを得なくなった。
3122,03_ＩＮＴＯ ＴＨＥ ＩＮＫＬＡＮＤＳ　インクランド探訪,122,,,スクループ,卑怯者,4_ruby,5,1_character,ストーリーボーン・ヴィランズ・エイリアン・海賊,5,2,2,2_uncommon,1,0,0,0,0,0,0,0,0,0,0,0,0,狂暴 このキャラクターはダメージを受けている間、+３される。,決して背中を見せてはならない。できれば風上にも置かない方がいい。
3123,03_ＩＮＴＯ ＴＨＥ ＩＮＫＬＡＮＤＳ　インクランド探訪,123,,,シンバ,やんちゃな仔ライオン,4_ruby,2,1_character,ストーリーボーン・ヒーロー・プリンス,1,1,3,3_rare,1,1,0,0,0,0,0,0,0,0,0,0,0,-,彼もロア狩りに加わるんだ、おやつの後でね。
3124,03_ＩＮＴＯ ＴＨＥ ＩＮＫＬＡＮＤＳ　インクランド探訪,124,,,スライトリー,ロスト・ボーイズ,4_ruby,4,1_character,ストーリーボーン・仲間,3,4,1,2_uncommon,1,0,0,0,2,0,0,0,0,0,0,0,0,キツネの悪知恵 あなたの場に《ピーター・パン》という名前のキャラクターがいるなら、このキャラクターをプレイするコストの支払いは１減る。回避（このキャラクターには回避を持つキャラクターだけがチャレンジできる。）,「海賊をだますなんて簡単さ！」
3125,03_ＩＮＴＯ ＴＨＥ ＩＮＫＬＡＮＤＳ　インクランド探訪,125,,,スティッチ,小型ロケット,4_ruby,2,1_character,ドリームボーン・ヒーロー・エイリアン,1,3,1,1_common,1,0,0,0,0,0,0,2,0,0,0,0,0,突進（このキャラクターはプレイされたターンにチャレンジできる。）,「スティッチにパワードスーツをあげようなんて考えたのは誰なの？！」― ナニ
3126,03_ＩＮＴＯ ＴＨＥ ＩＮＫＬＡＮＤＳ　インクランド探訪,126,,,早撃ち,的外れな狙撃手,4_ruby,2,1_character,ストーリーボーン・仲間,1,3,1,2_uncommon,1,0,0,0,0,0,0,0,0,0,0,0,0,バッチリこん あなたの《とんま》という名前のキャラクターは+１される。,「いいかげんにしろ早撃ち！弓こっちさ向けるでねえっつぅに！」― ノッティンガムのシェリフ
3127,03_ＩＮＴＯ ＴＨＥ ＩＮＫＬＡＮＤＳ　インクランド探訪,127,,,ウェビー・ヴァンダークワック,勝ち気なアヒルっ娘,4_ruby,3,1_character,ストーリーボーン・仲間,4,3,1,1_common,1,1,0,0,0,0,0,0,0,0,0,0,0,-,「グラップリングフックがあれば、ロア探しはずっと簡単よ！」
3128,03_ＩＮＴＯ ＴＨＥ ＩＮＫＬＡＮＤＳ　インクランド探訪,128,,,急降下爆撃,-,4_ruby,3,2_action,-,0,0,0,2_uncommon,1,0,0,0,0,2,0,0,0,0,0,0,0,暴勇を持つあなたのキャラクター１体を退場させることでそのキャラクターよりの小さいキャラクター１体を選び、退場させる。,-
3129,03_ＩＮＴＯ ＴＨＥ ＩＮＫＬＡＮＤＳ　インクランド探訪,129,,,I've Got a Dream,誰にでも夢はある,4_ruby,2,3_action・song,歌,0,0,0,2_uncommon,1,0,0,0,0,0,0,0,0,0,0,0,0,（コスト２以上のキャラクターはすることでこの歌をコストを支払わずに歌える。）ロケーションにいるあなたのキャラクター１体を選び、レディする。そのキャラクターはこのターン、クエストできない。そのロケーションのと同じ数のロアを得る。,トールの夢はお花屋さん グンターはインテリアデザイナー
3130,03_ＩＮＴＯ ＴＨＥ ＩＮＫＬＡＮＤＳ　インクランド探訪,130,,,起き上がれ！今すぐ！,-,4_ruby,4,2_action,-,0,0,0,3_rare,1,0,0,0,0,0,0,0,0,0,0,0,0,あなたのキャラクター全員をレディし、それらの各キャラクターに１ダメージを与える。それらはこのターン、クエストできない。,「奴らを捕らえろ！逃げられる前に！」
3131,03_ＩＮＴＯ ＴＨＥ ＩＮＫＬＡＮＤＳ　インクランド探訪,131,,,海渡り,-,4_ruby,1,2_action,-,0,0,0,1_common,1,0,0,0,0,0,0,0,0,0,0,0,0,あなたのキャラクターを２体までコストを支払わずに同じロケーションに移動する。,「海を渡ってた！…なんでやめたの？」― モアナ
3132,03_ＩＮＴＯ ＴＨＥ ＩＮＫＬＡＮＤＳ　インクランド探訪,132,,,マウイの釣り針,-,4_ruby,3,4_item,-,0,0,0,3_rare,1,0,0,0,2,0,0,0,0,0,0,0,0,マウイタイム！ あなたの場に《マウイ》という名前のキャラクターがいるなら、このアイテムの“変幻自在”という能力をコストを支払わずに使用してもよい。変幻自在 ，２ ： 以下から１つを選ぶ。・キャラクター１体を選び、このターン、+３する。・キャラクター１体を選び、そのキャラクターはあなたの次のターンの始めまで、回避を得る。（回避を持つキャラクターには回避を持つキャラクターだけがチャレンジできる。）,-
3133,03_ＩＮＴＯ ＴＨＥ ＩＮＫＬＡＮＤＳ　インクランド探訪,133,,,シュメールのタリスマン,-,4_ruby,3,4_item,-,0,0,0,2_uncommon,1,0,0,0,0,0,0,0,0,0,0,0,0,魔力の源 あなたのターンの間、あなたのキャラクター１体がチャレンジ中に退場するたび、カードを１枚引いてもよい。,「闇より呼び出されし霊魂よ、この半円の前に現れたまえ」― リナ・セイブルウィング
3134,03_ＩＮＴＯ ＴＨＥ ＩＮＫＬＡＮＤＳ　インクランド探訪,134,,,アグラバー,市場,4_ruby,3,5_location,-,5,0,2,1_common,1,1,0,0,0,0,0,0,0,0,0,0,0,-,「ようこそアグラバーへ、神秘に満ちた都ですぞ。お楽しみがいっぱい、寄ってらっしゃい見てらっしゃい。さ～あ商売だ！」― 商人
3135,03_ＩＮＴＯ ＴＨＥ ＩＮＫＬＡＮＤＳ　インクランド探訪,135,,,ジョリーロジャー号,フック船長の船,4_ruby,1,5_location,-,5,0,0,2_uncommon,1,0,0,0,0,0,0,2,0,0,0,0,0,抜かるんじゃねえぞ野郎ども！ ここにいるキャラクターは突進を得る。（突進を持つキャラクターはプレイされたターンにチャレンジできる。）皆の者デッキへ！ あなたの海賊・キャラクターはコストを支払わずにここに移動できる。,-
3136,03_ＩＮＴＯ ＴＨＥ ＩＮＫＬＡＮＤＳ　インクランド探訪,136,,,RLSレガシー号,ソーラーガレオン,4_ruby,4,5_location,-,8,0,2,3_rare,1,0,0,0,2,0,0,0,0,0,0,0,0,これが我々の船 ここにいるキャラクターは回避を得る。（回避を持つキャラクターには回避を持つキャラクターだけがチャレンジできる。）せっせと働けよ ここにあなたのキャラクターがいるなら、あなたがあなたのキャラクターをここに移動させるコストの支払いは２減る。,-
3137,03_ＩＮＴＯ ＴＨＥ ＩＮＫＬＡＮＤＳ　インクランド探訪,137,,,オードリー・ラミレズ,機関士,5_sapphire,5,1_character,ストーリーボーン・仲間,5,2,2,3_rare,1,0,0,0,0,0,0,0,0,0,0,0,2,魔除（対戦相手はチャレンジ以外でこのキャラクターを選べない。）スペアパーツ このキャラクターがクエストするたび、あなたのアイテム１つをレディする。,「そもそもコレ、どうやって壊すのさ？」
3138,03_ＩＮＴＯ ＴＨＥ ＩＮＫＬＡＮＤＳ　インクランド探訪,138,,,アメリア船長,総指揮官,5_sapphire,3,1_character,ストーリーボーン・エイリアン・キャプテン,5,1,1,1_common,1,0,0,0,2,0,0,0,0,0,0,0,0,規律 あなたのターンの間、このキャラクターは回避を得る。（このキャラクターは回避を持つキャラクターにチャレンジできる。）,「水平線上に奇妙な構造物を目視。操舵手、取舵一杯！」
3139,03_ＩＮＴＯ ＴＨＥ ＩＮＫＬＡＮＤＳ　インクランド探訪,139,,,デューイ,出たがり甥っ子,5_sapphire,3,1_character,ドリームボーン・仲間,3,2,2,2_uncommon,1,0,0,0,0,0,0,0,0,0,0,2,0,支援（このキャラクターがクエストするたび、他のキャラクター１体を選び、このターン、これのをそれのに加えてもよい。）,「やった！見つけたぞ！僕はデューイ活躍だ！」
3140,03_ＩＮＴＯ ＴＨＥ ＩＮＫＬＡＮＤＳ　インクランド探訪,140,,,フリントハート・グロムゴールド,不正な独り者,5_sapphire,4,1_character,ストーリーボーン・ヴィランズ,4,3,2,2_uncommon,1,0,0,0,2,0,0,0,0,0,0,0,0,予想もできまい！ あなたのターンの間、このキャラクターは回避を得る。（このキャラクターは回避を持つキャラクターにチャレンジできる。）,「このフリントハート・グロムゴールドに指図はさせん！」
3141,03_ＩＮＴＯ ＴＨＥ ＩＮＫＬＡＮＤＳ　インクランド探訪,141,,,ジーニー,狭いランプからコンニチワ,5_sapphire,2,1_character,ストーリーボーン・仲間,2,2,2,2_uncommon,1,1,0,0,0,0,0,0,0,0,0,0,0,-,「1万年間もじーっとしてたから首がガッチガッチだわさ！」
3142,03_ＩＮＴＯ ＴＨＥ ＩＮＫＬＡＮＤＳ　インクランド探訪,142,,,タラおばあちゃん,昔話の守り手,5_sapphire,4,1_character,ストーリーボーン・導き手,3,3,1,1_common,1,0,0,0,0,0,0,0,0,0,0,0,0,始まりは海しかなかった このキャラクターをプレイしたとき、あなたのデッキの上からカードを２枚見る。そのうち１枚を手札に加えてもよい。残りを好きな順番でデッキの一番下に置く。,心して耳を傾ければ、ご先祖様たちが導いてくれるのさ。
3143,03_ＩＮＴＯ ＴＨＥ ＩＮＫＬＡＮＤＳ　インクランド探訪,143,,,タラおばあちゃん,海の精霊,5_sapphire,7,1_character,フラッドボーン・導き手,8,4,2,5_legendary,1,0,0,0,0,0,0,0,2,0,0,0,0,変身５（５を支払うことであなたの《タラおばあちゃん》の上にこのカードをプレイしてもよい。）お前はだれか？ あなたのインクウェルにカード１枚が置かれるたび、ロアを１つ得る。,彼女はいつもきみのそばにいるんだ、どんなに遠くへ旅しようとも。
3144,03_ＩＮＴＯ ＴＨＥ ＩＮＫＬＡＮＤＳ　インクランド探訪,144,,,ジャイロ・ギアルーズ,ガジェット作りの天才,5_sapphire,3,1_character,ストーリーボーン・仲間・発明家,4,1,1,3_rare,1,0,0,0,0,0,0,0,0,0,0,0,0,私の頭脳について来て  ： あなたの捨て札からアイテム・カード１枚をデッキの一番上に置く。,「今回は電球ロボットもあんまり暴走しないですむかも…」
3145,03_ＩＮＴＯ ＴＨＥ ＩＮＫＬＡＮＤＳ　インクランド探訪,145,,,ヒューイ,しっかり甥っ子,5_sapphire,2,1_character,ドリームボーン・仲間,2,2,1,3_rare,1,0,0,0,0,0,0,0,0,0,0,2,0,支援（このキャラクターがクエストするたび、他のキャラクター１体を選び、このターン、これのをそれのに加えてもよい。）三つ子の甥っ子 このキャラクターがクエストするたび、あなたの場に《デューイ》という名前のキャラクターと《ルーイ》という名前のキャラクターがいるなら、カードを３枚引いてもよい。,「おっきなクリスタルの欠片みたい！」
3146,03_ＩＮＴＯ ＴＨＥ ＩＮＫＬＡＮＤＳ　インクランド探訪,146,,,キング・ルーイ,バンドリーダー,5_sapphire,7,1_character,ストーリーボーン・仲間・王様,7,7,3,1_common,1,1,0,0,0,0,0,0,0,0,0,0,0,-,「待ちなよ、兄弟。腰を下ろしてスイートなビートを楽しんでかないか？」
3147,03_ＩＮＴＯ ＴＨＥ ＩＮＫＬＡＮＤＳ　インクランド探訪,147,,,キット・クラウドキッカー,航空士,5_sapphire,6,1_character,フラッドボーン・仲間,5,2,3,2_uncommon,1,0,0,0,0,0,0,0,2,0,0,0,2,変身３（３を支払うことであなたの《キット・クラウドキッカー》の上にこのカードをプレイしてもよい。）魔除（対戦相手はチャレンジ以外でこのキャラクターを選べない。）,-
3148,03_ＩＮＴＯ ＴＨＥ ＩＮＫＬＡＮＤＳ　インクランド探訪,148,,,キット・クラウドキッカー,活発なクマの子,5_sapphire,1,1_character,ストーリーボーン・仲間,1,0,1,1_common,1,0,0,0,0,0,0,0,0,0,0,0,2,魔除（対戦相手はチャレンジ以外でこのキャラクターを選べない。）,愛用のスカイボードを取り戻したことに興奮して、彼はインクランドに飛び立った。
3149,03_ＩＮＴＯ ＴＨＥ ＩＮＫＬＡＮＤＳ　インクランド探訪,149,,,ルーイ,ちゃっかり甥っ子,5_sapphire,4,1_character,ドリームボーン・仲間,4,3,2,1_common,1,0,0,0,0,0,0,0,0,0,0,2,0,支援（このキャラクターがクエストするたび、他のキャラクター１体を選び、このターン、これのをそれのに加えてもよい。）,「最後の一つ、みつけた！」
3150,03_ＩＮＴＯ ＴＨＥ ＩＮＫＬＡＮＤＳ　インクランド探訪,150,,,マリアン姫,夢見るお年頃,5_sapphire,5,1_character,ストーリーボーン・プリンセス,4,4,2,1_common,1,0,0,0,0,0,0,0,0,0,0,0,0,高貴なお姫様 このキャラクターをプレイしたとき、キャラクター１体を選び、このターン、-２する。,彼女はあらゆる場面をより美しくしてくれる。
3151,03_ＩＮＴＯ ＴＨＥ ＩＮＫＬＡＮＤＳ　インクランド探訪,151,,,ママ・オーディ,神秘の専門家,5_sapphire,3,1_character,ストーリーボーン・導き手,3,1,1,3_rare,1,0,0,0,0,0,0,0,0,0,0,0,0,こりゃいいね あなたが歌をプレイするたび、あなたのデッキの一番上のカードをインクウェルにエグザートかつ裏向きで置いてもよい。,「もう一度考えて、ホントの願いを見つけたら…」
3152,03_ＩＮＴＯ ＴＨＥ ＩＮＫＬＡＮＤＳ　インクランド探訪,152,,,プルート,ミッキーのかしこい友だち,5_sapphire,3,1_character,ドリームボーン・仲間,4,3,1,1_common,1,1,0,0,0,0,0,0,0,0,0,0,0,-,プルートの役目は、ミニーが洞窟に行けるようグスタフの注意を引きつけておくことだった。
3153,03_ＩＮＴＯ ＴＨＥ ＩＮＫＬＡＮＤＳ　インクランド探訪,153,,,ルーファス,”子供の家”のネコ,5_sapphire,5,1_character,ドリームボーン・仲間,5,4,1,1_common,1,0,0,0,0,0,0,0,0,0,0,0,0,もうネズミは追えん このキャラクターが退場したとき、このカードをあなたのインクウェルにエグザートかつ裏向きで置いてもよい。,「希望とは、遠くに見える青い鳥のようなものだ」
3154,03_ＩＮＴＯ ＴＨＥ ＩＮＫＬＡＮＤＳ　インクランド探訪,154,,,スクルージ・マクダック,世界一の金持ちアヒル,5_sapphire,5,1_character,ストーリーボーン・ヒーロー,5,3,1,4_superrare,1,0,0,0,2,0,0,0,0,0,0,0,0,今日はもう帰る！ あなたのターンの間、このキャラクターは回避を得る。（このキャラクターは回避を持つキャラクターにチャレンジできる。）頭使わなきゃリッチにはなれん あなたのターンの間、このキャラクターがチャレンジ中に他のキャラクター１体を退場させるたび、アイテム１枚をコストを支払わずにプレイしてもよい。,彼はどこでだろうと金を稼げるんだ。
3155,03_ＩＮＴＯ ＴＨＥ ＩＮＫＬＡＮＤＳ　インクランド探訪,155,,,スクルージ・マクダック,金持ち伯父さん,5_sapphire,2,1_character,ドリームボーン・ヒーロー,3,1,1,2_uncommon,1,0,0,0,0,0,0,0,0,0,0,0,0,宝探し名人 このキャラクターがクエストするたび、このターン、あなたが次にアイテムをプレイするコストの支払いは１減る。,「見知らぬ新世界は、見知らぬ新財産を築くのに最適な場所じゃ！」
