cardId,setSeries,idInSetSeries,icon,backIcon,name,versionName,color,cost,cardType,classification,willpower,strength,loreValue,rarity,inkwellFlag,vanillaFlag,bodyguardFlag,challengerFlag,evasiveFlag,recklessFlag,resistFlag,rushFlag,shiftFlag,singerFlag,singTogetherFlag,supportFlag,wardFlag,effectText,flavorText
3156,03_ＩＮＴＯ ＴＨＥ ＩＮＫＬＡＮＤＳ　インクランド探訪,156,,,女王,鏡の追求者,5_sapphire,4,1_character,ストーリーボーン・ヴィランズ・女王・魔法使い,5,2,1,2_uncommon,1,0,0,0,0,0,0,0,0,0,0,0,0,計算高いうぬぼれ屋 このキャラクターがクエストするたび、あなたのデッキの上からカードを３枚見て、それらを好きな順番でデッキの一番上に置いてもよい。,女王の質問は常にひとつ、だが答えはいつも満足できるとは限らない。
3157,03_ＩＮＴＯ ＴＨＥ ＩＮＫＬＡＮＤＳ　インクランド探訪,157,,,ティンカー・ベル,とっても賢い妖精,5_sapphire,5,1_character,ドリームボーン・仲間・妖精,4,3,2,4_superrare,1,0,0,0,0,0,0,0,0,0,0,0,0,私なら使えるわ あなたのアイテム１つが退場するたび、そのカードをあなたのインクウェルにエグザートかつ裏向きで置いてもよい。,彼女は可能性の世界に生きている。
3158,03_ＩＮＴＯ ＴＨＥ ＩＮＫＬＡＮＤＳ　インクランド探訪,158,,,ウェンディ・ダーリング,ピーター・パン博士,5_sapphire,3,1_character,ストーリーボーン・ヒーロー,1,3,2,4_superrare,1,0,0,0,0,0,0,0,0,0,0,2,2,魔除（対戦相手はチャレンジ以外でこのキャラクターを選べない。）支援（このキャラクターがクエストするたび、他のキャラクター１体を選び、このターン、これのをそれのに加えてもよい。）,-
3159,03_ＩＮＴＯ ＴＨＥ ＩＮＫＬＡＮＤＳ　インクランド探訪,159,,,注意そらし,-,5_sapphire,2,2_action,-,0,0,0,1_common,1,0,0,0,0,0,0,0,0,0,0,0,0,キャラクター１体を選び、このターン、-２する。カードを１枚引く。,-
3160,03_ＩＮＴＯ ＴＨＥ ＩＮＫＬＡＮＤＳ　インクランド探訪,160,,,Friend Like Me,フレンド・ライク・ミー,5_sapphire,5,3_action・song,歌,0,0,0,3_rare,1,0,0,0,0,0,0,0,0,0,0,0,0,（コスト５以上のキャラクターはすることでこの歌をコストを支払わずに歌える。）各プレイヤーは自分のデッキの上からカードを３枚インクウェルにエグザートかつ裏向きで置く。,すごいパワー 赤のコーナー そうさパンチはバクダーン！
3161,03_ＩＮＴＯ ＴＨＥ ＩＮＫＬＡＮＤＳ　インクランド探訪,161,,,How Far I'll Go,どこまでも,5_sapphire,4,3_action・song,歌,0,0,0,2_uncommon,1,0,0,0,0,0,0,0,0,0,0,0,0,（コスト４以上のキャラクターはすることでこの歌をコストを支払わずに歌える。）あなたのデッキの上からカードを２枚見る。そのうち１枚を手札に、もう１枚をインクウェルにエグザートかつ裏向きで置く。,-
3162,03_ＩＮＴＯ ＴＨＥ ＩＮＫＬＡＮＤＳ　インクランド探訪,162,,,修理,-,5_sapphire,2,2_action,-,0,0,0,1_common,1,0,0,0,0,0,0,0,0,0,0,0,0,あなたのロケーション１つかキャラクター１体を選び、３ダメージまで取り除く。,「ここに工場開こうかって考えてんだ。あんたどう思う？」
3163,03_ＩＮＴＯ ＴＨＥ ＩＮＫＬＡＮＤＳ　インクランド探訪,163,,,オーレリアン・ジャイロセンサー,-,5_sapphire,2,4_item,-,0,0,0,3_rare,1,0,0,0,0,0,0,0,0,0,0,0,0,知識探知 あなたのキャラクター１体がクエストするたび、あなたのデッキの一番上のカードを見てもよい。それをデッキの一番上か一番下に置く。,「こいつは失われたロアの在処を指し示してくれる。ただし足下は自分で注意しろ」― イルミニアのヴェンチュロ
3164,03_ＩＮＴＯ ＴＨＥ ＩＮＫＬＡＮＤＳ　インクランド探訪,164,,,テ・フィティの心,-,5_sapphire,3,4_item,-,0,0,0,3_rare,1,0,0,0,0,0,0,0,0,0,0,0,0,命を創り出す ，２ ： あなたのデッキの一番上のカードをインクウェルにエグザートかつ裏向きで置く。,荒れ狂う内なる嵐をなだめるには、純粋な心が必要だ。
3165,03_ＩＮＴＯ ＴＨＥ ＩＮＫＬＡＮＤＳ　インクランド探訪,165,,,ラッキーダイム,-,5_sapphire,7,4_item,-,0,0,0,5_legendary,1,0,0,0,0,0,0,0,0,0,0,0,0,わしの宝物 ，２ ： あなたのキャラクター１体を選び、そのキャラクターのと同じ数のロアを得る。,このたった1枚のありふれたコインが、スクルージの人生を大きく変えた。
3166,03_ＩＮＴＯ ＴＨＥ ＩＮＫＬＡＮＤＳ　インクランド探訪,166,,,スクルージのシルクハット,-,5_sapphire,2,4_item,-,0,0,0,2_uncommon,1,0,0,0,0,0,0,0,0,0,0,0,0,商売上手  ： このターン、あなたが次にアイテムをプレイするコストの支払いは１減る。,彼の苦労を知る、愛用の知る苦ハット。
3167,03_ＩＮＴＯ ＴＨＥ ＩＮＫＬＡＮＤＳ　インクランド探訪,167,,,金庫の扉,-,5_sapphire,4,4_item,-,0,0,0,1_common,1,0,0,0,0,0,2,0,0,0,0,0,0,封鎖 あなたのロケーションと、ロケーションにいるあなたのキャラクターは耐久+１を得る。（耐久+１を持つロケーションとキャラクターに与えられるダメージは１減る。）,この金庫を知るのはスクルージだけ。これからもずっと。
3168,03_ＩＮＴＯ ＴＨＥ ＩＮＫＬＡＮＤＳ　インクランド探訪,168,,,ベルの家,モーリスの工房,5_sapphire,1,5_location,-,6,0,0,3_rare,1,0,0,0,0,0,0,0,0,0,0,0,0,研究室 ここにあなたのキャラクターがいるなら、あなたがアイテムをプレイするコストの支払いは１減る。,ロルカナの最も重要な道具の一部が、ここで造られている。
3169,03_ＩＮＴＯ ＴＨＥ ＩＮＫＬＡＮＤＳ　インクランド探訪,169,,,マクダック邸,スクルージの屋敷,5_sapphire,4,5_location,-,9,0,2,1_common,1,1,0,0,0,0,0,0,0,0,0,0,0,-,「これこそが、ロルカナで一番クールな家よ！」― ウェビー・ヴァンダークワック
3170,03_ＩＮＴＯ ＴＨＥ ＩＮＫＬＡＮＤＳ　インクランド探訪,170,,,モトゥヌイ,楽園の島,5_sapphire,2,5_location,-,5,0,1,2_uncommon,1,0,0,0,0,0,0,0,0,0,0,0,0,生まれかわり ここにいるキャラクター１体が退場するたび、そのカードをあなたのインクウェルにエグザートかつ裏向きで置いてもよい。,-
3171,03_ＩＮＴＯ ＴＨＥ ＩＮＫＬＡＮＤＳ　インクランド探訪,171,,,村長トゥイ,モトゥヌイの誇り,6_steel,4,1_character,ストーリーボーン・導き手・王様,4,3,2,1_common,1,1,0,0,0,0,0,0,0,0,0,0,0,-,「この島をみろ！ここより素晴らしい場所などない」
3172,03_ＩＮＴＯ ＴＨＥ ＩＮＫＬＡＮＤＳ　インクランド探訪,172,,,イーヨー,ぎゅうぎゅう詰めのロバ,6_steel,5,1_character,ストーリーボーン・仲間,5,4,1,1_common,1,0,0,0,0,0,2,0,0,0,0,0,0,耐久+１（このキャラクターに与えられるダメージは１減る。）,「ぼくの通せんぼじゃあまり役に立たないだろうけど、やってみる」
3173,03_ＩＮＴＯ ＴＨＥ ＩＮＫＬＡＮＤＳ　インクランド探訪,173,,,巨人のグスタフ,王国への脅威,6_steel,3,1_character,ドリームボーン・ヴィランズ,6,6,1,3_rare,1,0,0,0,0,0,0,0,0,0,0,0,0,ぐるぐる巻き このキャラクターはエグザートで場に出て、あなたのターンの始めにレディしない。ブチ切れ あなたのターンの間、あなたの他のキャラクター１体がチャレンジ中に他のキャラクター１体を退場させるたび、このキャラクターをレディしてもよい。,-
3174,03_ＩＮＴＯ ＴＨＥ ＩＮＫＬＡＮＤＳ　インクランド探訪,174,,,ハデス,怒髪天の支配者,6_steel,6,1_character,ストーリーボーン・ヴィランズ・神格,5,5,2,3_rare,1,0,0,0,0,0,0,0,0,0,0,0,0,巨人族の呼び声  ： あなたのタイタン・キャラクター全員をレディする。,「友よ！タイタン族よ！牢獄に押し込められて気の毒にな。一体誰の仕業だ？」
3175,03_ＩＮＴＯ ＴＨＥ ＩＮＫＬＡＮＤＳ　インクランド探訪,175,,,ヘルガ・シンクレア,司令官の右腕,6_steel,3,1_character,ストーリーボーン・ヴィランズ,4,2,1,1_common,1,0,0,2,0,0,0,0,0,0,0,0,0,果敢+２（このキャラクターはチャレンジしている間、+２される。）,「今のは命令よ。早くして。さあ！」
3176,03_ＩＮＴＯ ＴＨＥ ＩＮＫＬＡＮＤＳ　インクランド探訪,176,,,ジョン・シルバー,強欲な宝探し屋,6_steel,3,1_character,ドリームボーン・ヴィランズ・エイリアン・海賊・キャプテン,3,3,1,3_rare,1,0,0,0,0,0,2,0,0,0,0,0,0,自分で針路を決めろ このキャラクターはあなたの場のロケーションと同じ数だけ、耐久+１を得て+１される。（耐久+１を持つキャラクターに与えられるダメージは１減る。）,「俺はな、ゲームって奴が得意じゃなかった。だが負けるのは嫌れえだ」
3177,03_ＩＮＴＯ ＴＨＥ ＩＮＫＬＡＮＤＳ　インクランド探訪,177,,,キーダ,王族の戦士,6_steel,2,1_character,ストーリーボーン・ヒーロー・プリンセス,3,2,1,1_common,1,0,2,0,0,0,0,0,0,0,0,0,0,護衛（このキャラクターをエグザートで場に出してもよい。あなたのキャラクターにチャレンジする対戦相手のキャラクターは、可能なら護衛を持つキャラクターを選ぶ。）,奇妙なものを多く見てきた彼女だが、こんなものは初めてだった。
3178,03_ＩＮＴＯ ＴＨＥ ＩＮＫＬＡＮＤＳ　インクランド探訪,178,,,リトル・ジョン,とんちに長けた無法者,6_steel,6,1_character,フラッドボーン・ヒーロー,5,4,2,4_superrare,1,0,2,0,0,0,2,0,2,0,0,0,0,変身４（４を支払うことであなたの《リトル・ジョン》の上にこのカードをプレイしてもよい。）いいか？大旦那 このキャラクターがエグザートしている間、護衛を持つあなたのキャラクターは耐久+１を得て、+１される。（耐久+１を持つキャラクターに与えられるダメージは１減る。）,-
3179,03_ＩＮＴＯ ＴＨＥ ＩＮＫＬＡＮＤＳ　インクランド探訪,179,,,リトル・ジョン,ロビンの相棒,6_steel,3,1_character,ストーリーボーン・仲間,4,2,1,2_uncommon,1,0,2,0,2,0,0,0,0,0,0,0,0,護衛（このキャラクターをエグザートで場に出してもよい。あなたのキャラクターにチャレンジする対戦相手のキャラクターは、可能なら護衛を持つキャラクターを選ぶ。）変装中 あなたのターンの間、このキャラクターは回避を得る。（このキャラクターは回避を持つキャラクターにチャレンジできる。）,-
3180,03_ＩＮＴＯ ＴＨＥ ＩＮＫＬＡＮＤＳ　インクランド探訪,180,,,リトス,ロックタイタン,6_steel,4,1_character,ストーリーボーン・タイタン,1,4,1,2_uncommon,1,0,0,0,0,0,2,0,0,0,0,0,0,耐久+２（耐久+２を持つキャラクターに与えられるダメージは２減る。）岩肌  ： キャラクター１体を選び、そのキャラクターはこのターン、耐久+２を得る。,「ゼウスをつぶせ！」
3181,03_ＩＮＴＯ ＴＨＥ ＩＮＫＬＡＮＤＳ　インクランド探訪,181,,,ミッキーマウス,勇敢な探検家,6_steel,3,1_character,ドリームボーン・ヒーロー,3,3,1,1_common,1,0,0,0,0,0,0,0,0,0,0,0,0,調べてみよう このキャラクターはあなたの場のロケーションと同じ数だけ+１される。,ミッキーには魔法使いの帽子のありかについての心当たりはあったが、それが守られていることは予想していなかった。
3182,03_ＩＮＴＯ ＴＨＥ ＩＮＫＬＡＮＤＳ　インクランド探訪,182,,,ミッキーマウス,ラッパ吹き,6_steel,4,1_character,ドリームボーン・ヒーロー,1,0,1,5_legendary,1,0,0,0,0,0,0,0,0,0,0,0,0,よびだし ，２ ： キャラクター１枚をコストを支払わずにプレイする。,-
3183,03_ＩＮＴＯ ＴＨＥ ＩＮＫＬＡＮＤＳ　インクランド探訪,183,,,ミニーマウス,ファンキーな洞窟探検家,6_steel,1,1_character,ドリームボーン・ヒーロー,3,0,1,1_common,1,0,0,0,0,0,0,0,0,0,0,0,0,ドキドキ洞窟探検 このキャラクターはロケーションにいる間、+２される。,洞いう状況になっても窟しない
3184,03_ＩＮＴＯ ＴＨＥ ＩＮＫＬＡＮＤＳ　インクランド探訪,184,,,ミスター・スミー,マヌケなお仲間,6_steel,2,1_character,ストーリーボーン・仲間・海賊,3,3,2,2_uncommon,1,0,0,0,0,0,0,0,0,0,0,0,0,いけませんて船長 あなたのターン終了時、このキャラクターがエグザートしていてあなたの場にキャプテン・キャラクターがいないなら、このキャラクターに１ダメージを与える。,「あいつらを捕まえ…あイタ！」
3185,03_ＩＮＴＯ ＴＨＥ ＩＮＫＬＡＮＤＳ　インクランド探訪,185,,,ムファサ,プライドランドの英雄,6_steel,7,1_character,ストーリーボーン・導き手・王様,10,3,3,3_rare,1,1,0,0,0,0,0,0,0,0,0,0,0,-,その英雄の名を聞くだけで、ハイエナどもが震え上がる。
3186,03_ＩＮＴＯ ＴＨＥ ＩＮＫＬＡＮＤＳ　インクランド探訪,186,,,ナラ,獰猛な幼なじみ,6_steel,3,1_character,ストーリーボーン・仲間,4,2,2,2_uncommon,1,1,0,0,0,0,0,0,0,0,0,0,0,-,「またあたしの勝ち。」
3187,03_ＩＮＴＯ ＴＨＥ ＩＮＫＬＡＮＤＳ　インクランド探訪,187,,,パイロス,ラーバタイタン,6_steel,5,1_character,ストーリーボーン・タイタン,4,5,1,3_rare,1,0,0,0,0,0,0,0,0,0,0,0,0,噴火 あなたのターンの間、このキャラクターがチャレンジ中に他のキャラクター１体を退場させるたび、キャラクター１体を選び、レディしてもよい。,「ゼウスをとかせ！」
3188,03_ＩＮＴＯ ＴＨＥ ＩＮＫＬＡＮＤＳ　インクランド探訪,188,,,ラズール,宮殿の衛兵,6_steel,2,1_character,ストーリーボーン・仲間・キャプテン,3,1,1,1_common,1,0,0,0,0,0,0,0,0,0,0,0,0,こりゃ勇ましい このキャラクターは１ダメージも受けていない間、+２される。,「今回は助けてくれるお姫様はいないぞ？ドブネズミ」
3189,03_ＩＮＴＯ ＴＨＥ ＩＮＫＬＡＮＤＳ　インクランド探訪,189,,,ロビン・フッド,人気の無法者,6_steel,1,1_character,ストーリーボーン・ヒーロー,2,2,1,1_common,1,1,0,0,0,0,0,0,0,0,0,0,0,-,「これが待ち伏せだって？チッ、チッ。マジボケの間違いだろ？」
3190,03_ＩＮＴＯ ＴＨＥ ＩＮＫＬＡＮＤＳ　インクランド探訪,190,,,ロビン・フッド,シャーウッドの英雄,6_steel,5,1_character,フラッドボーン・ヒーロー,6,3,2,5_legendary,1,0,0,0,0,0,0,0,2,0,0,0,0,変身３（３を支払うことであなたの《ロビン・フッド》の上にこのカードをプレイしてもよい。）凄腕の闘士 あなたのターンの間、このキャラクターがチャレンジ中に他のキャラクター１体を退場させるたび、ロアを２つ得る。世のため皆のため このキャラクターがチャレンジ中に退場したとき、カードを１枚引いてもよい。,-
3191,03_ＩＮＴＯ ＴＨＥ ＩＮＫＬＡＮＤＳ　インクランド探訪,191,,,ノッティンガムのシェリフ,汚職代官,6_steel,4,1_character,ドリームボーン・ヴィランズ,4,2,1,4_superrare,1,0,0,0,0,0,0,0,0,0,0,0,0,痛くてこそ税 あなたがカードを１枚捨てるたび、対戦相手のキャラクター１体を選び、１ダメージを与えてもよい。,悪役のルールその13: 最後の一滴まで搾り取れ、当然笑いながら。
3192,03_ＩＮＴＯ ＴＨＥ ＩＮＫＬＡＮＤＳ　インクランド探訪,192,,,シンバ,戦う王子,6_steel,7,1_character,ドリームボーン・ヒーロー・プリンス,7,5,2,4_superrare,1,0,0,0,0,0,0,0,0,0,0,0,0,明け渡すか、戦うかだ このキャラクターをプレイしたとき、またはあなたのターンの間、これがチャレンジ中に他のキャラクター１体を退場させるたび、以下から１つを選んでもよい。・カードを２枚引き、その後カードを２枚選んで捨てる。・キャラクター１体を選び、２ダメージを与える。,プライドランドの栄光を取り戻す覚悟が彼にはある。
3193,03_ＩＮＴＯ ＴＨＥ ＩＮＫＬＡＮＤＳ　インクランド探訪,193,,,シンバ,唯一の王,6_steel,5,1_character,ストーリーボーン・ヒーロー・王様,6,4,1,2_uncommon,1,0,0,0,0,0,0,0,0,0,0,0,0,王者の風格 あなたのターンの間、このキャラクターがチャレンジ中に他のキャラクター１体を退場させるたび、対戦相手のキャラクター１体を選び、そのキャラクターはそれのプレイヤーの次のターンの間、チャレンジできない。,危険が増え続ける今、群れには守護者が必要だ。
3194,03_ＩＮＴＯ ＴＨＥ ＩＮＫＬＡＮＤＳ　インクランド探訪,194,,,サディアス・E・クラング,鋼の頭目,6_steel,5,1_character,ストーリーボーン・ヴィランズ,5,3,2,2_uncommon,1,0,0,0,0,0,0,0,0,0,0,0,0,私の歯はもっと鋭いぞ このキャラクターがロケーションにいる間、これがクエストするたび、キャラクター１体を選び、１ダメージを与えてもよい。,「我が鐘がまもなくお前の破滅を鳴り響かせるであろう！」
3195,03_ＩＮＴＯ ＴＨＥ ＩＮＫＬＡＮＤＳ　インクランド探訪,195,,,そこに登場、ゼウス！,-,6_steel,4,3_action・song,歌,0,0,0,3_rare,1,0,0,0,0,0,0,0,0,0,0,0,0,（コスト４以上のキャラクターはすることでこの歌をコストを支払わずに歌える。）キャラクター１体かロケーション１つを選び、５ダメージを与える。,光るサンダー・ボルト（ドカン！）奴ら閉じ込め（いま！）カオス終わりを告げた！（告げたぁ！）
3196,03_ＩＮＴＯ ＴＨＥ ＩＮＫＬＡＮＤＳ　インクランド探訪,196,,,ドッカーン！,-,6_steel,2,2_action,-,0,0,0,1_common,1,0,0,0,0,0,0,0,0,0,0,0,0,キャラクター１体かロケーション１つを選び、２ダメージを与える。,平均的ドカーン！よりもビッグだぜ！
3197,03_ＩＮＴＯ ＴＨＥ ＩＮＫＬＡＮＤＳ　インクランド探訪,197,,,オリンポスはあっち,-,6_steel,1,2_action,-,0,0,0,1_common,1,0,0,0,0,0,0,0,0,0,0,0,0,このターン、あなたのキャラクターはロケーションにチャレンジしている間、+３される。,「さあ今自由にしてやるぞ！まず最初に！何する？」― ハデス
3198,03_ＩＮＴＯ ＴＨＥ ＩＮＫＬＡＮＤＳ　インクランド探訪,198,,,タイタンの戦い,-,6_steel,3,2_action,-,0,0,0,2_uncommon,1,0,0,0,0,0,0,0,0,0,0,0,0,ロケーション１つかアイテム１つを選び、退場させる。,「うわあ大変！うわあ一大事！」― ヘルメス
3199,03_ＩＮＴＯ ＴＨＥ ＩＮＫＬＡＮＤＳ　インクランド探訪,199,,,フック船長のレイピア,-,6_steel,3,4_item,-,0,0,0,2_uncommon,1,0,0,2,0,0,0,0,0,0,0,0,0,早いとこ刻んじまえ！ あなたのターンの間、あなたのキャラクター１体がチャレンジ中に他のキャラクター１体を退場させるたび、１を支払うことでカードを１枚引いてもよい。堂々と戦え！ あなたの《フック船長》という名前のキャラクターは果敢+１を得る。（果敢+１を持つキャラクターはチャレンジしている間、+１される。）,-
3200,03_ＩＮＴＯ ＴＨＥ ＩＮＫＬＡＮＤＳ　インクランド探訪,200,,,ギズモスーツ,-,6_steel,3,4_item,-,0,0,0,1_common,1,0,0,0,0,0,2,0,0,0,0,0,0,サイバーアーマー このアイテムを退場させる ： キャラクター１体を選び、そのキャラクターはあなたの次のターンの始めまで、耐久+２を得る。（耐久+２を持つキャラクターに与えられるダメージは２減る。）,ロルカナの殿堂で静かに立つそれは、誰かの秘密の合言葉を待っている。
3201,03_ＩＮＴＯ ＴＨＥ ＩＮＫＬＡＮＤＳ　インクランド探訪,201,,,トレジャー・プラネットへの地図,-,6_steel,3,4_item,-,0,0,0,3_rare,1,0,0,0,0,0,0,0,0,0,0,0,0,ゲートの鍵  ： このターン、あなたが次にロケーションをプレイするコストの支払いは１減る。道を示す あなたがあなたのキャラクターをロケーションに移動させるコストの支払いは１減る。,「地図は使ってない時は、鍵をかけて保管します」― アメリア船長
3202,03_ＩＮＴＯ ＴＨＥ ＩＮＫＬＡＮＤＳ　インクランド探訪,202,,,マウイの流刑島,隠された島,6_steel,2,5_location,-,5,0,0,3_rare,1,0,0,0,0,0,2,0,0,0,0,0,0,隔絶 ここにいるキャラクターは耐久+１を得る。（耐久+１を持つキャラクターに与えられるダメージは１減る。）,岩と砂しかない…無視されやすい。
3203,03_ＩＮＴＯ ＴＨＥ ＩＮＫＬＡＮＤＳ　インクランド探訪,203,,,ノッティンガム,プリンス・ジョンの城,6_steel,2,5_location,-,6,0,1,1_common,1,1,0,0,0,0,0,0,0,0,0,0,0,-,サー・ヒス「殿下、母上のお城は私たちの計略を練るのに最適な場所ですぞ！」プリンス・ジョン「ママー！」
3204,03_ＩＮＴＯ ＴＨＥ ＩＮＫＬＡＮＤＳ　インクランド探訪,204,,,バイユー,謎めいた沼,6_steel,1,5_location,-,3,0,1,2_uncommon,1,0,0,0,0,0,0,0,0,0,0,0,0,案内するよ君らのため ここにいるキャラクター１体がクエストするたび、「カードを１枚引き、その後カードを１枚選んで捨てる。」をしてもよい。,欲しいものではなく、必要なものを見つける場所。
